028,1996-08-16,"Fiesta Trashnoche en El Ojo","Federico Lacroze 2620, Buenos Aires","Artist: Frecuencia Infinita;Venue: El Ojo;Genre: EBM;Genre: Techno Pop;Genre: Rave;Genre: Hardcore","Voy a tratar de tocar el tema humano lo menos posible, para no recordar lo que vi esa noche. El lugar no estaba del todo completo. Llegué temprano porque tenía que pasar música (llevé mucho Rave!), y estaba ansioso y nervioso por ese momento.\n\nAl principio había cosas ambientales y comentarios a-lo-Sandro del Sr. Marenda. Estaban todos los chicos: Luciano, Luis, Fernando, Cristian, Leo, Sebastián, Adrián, Condor, Caba, Claudio, Javier, Silvia, Sergio, Cesar, Cecilia, etc.\n\nEn la puerta había una figura de cartón de William Shatner (Captain Kirk), y el lugar estaba decorado muy bien, nada que ver con lo que ví el año pasado (05/08/95, pág. 87).\n\nAl principio pusieron partes de temas techno de la década pasada (Depeche Mode, Cetu Javu, Front 242, Nitzer Ebb, Eurythmics, Soft Cell, Yazoo, Peter Schilling), y después de un potente tema se largó el trance y el techno de los DJs de la Urban Groove.\n\nFue subiendo Miguel Silver y Gustavo López, Luis Nieva nos mató con algo de Rave ('Frequency', 'Dominator'). Pero casi siempre somos los mismos...Ignacio, Rubén, Caba, Bruno,...\n\nHubo un desfile de ropa Sixxy con un tipo con cara de gargolero y una mujer horrible. Les gritamos de todo.\n\nDespués tocó Frecuencia Infinita y sonó muy bien, la gente no se movió tanto, y después tocó Diego Cid y volamos con Plexus 'The Cactus Is Saved', 'I'm The Creator', 'G-Force', 'Fire', etc. Caos total en mi cabeza, imágenes, luces, gritos, abejorros, bajos, euforia. Grité muy fuerte: 'bailen argentinos de mierda ¡quiero ser un kelper!' Y se largó el tema de Dye Witness 'What Would You Like To Hear Again?'. Con Luis y algunos chicos destrozamos el suelo. Now!! Release Your Anger!\n\nDespués tocó Jason, y después me tocó a mí para terminar. Directamente de las Technics (CD player), largué con 'Temple of Dreams (Hardcore Mix)', después 'How Does It Feel', 'Nana', 'Wind It Up (Tightly Wound)', la que llevaba a Lipsy, Hocus Pocus 'Here's Johnny (Ramirez Remix)', para que se acuerden quién estaba en la cabina. \n\nThe Carpenter 'Let's Blow This Joint, 'Firestarter (Empirion Mix)' (Cesar me pidió 'Molotov Bitch'), Jones & Stephenson 'The First Rebirth' (escuché gritos), y destroce los tímpanos de todo el mundo con Illigal Alien 'Frankfurt This Is The Hague' y Sorcerer 'Summer'. Me fui con 'Brand New', de Fini Tribe.","/images/1996-ElOjo-16-08-96.png;/images/1996-ElOjo.png;/images/TheSecondReport_0152b.png;/images/TheSecondReport_0153.png;/images/TheSecondReport_0153b.png;/images/TheSecondReport_0154.png"
029,1996-08-23,"Pantheon After Hours","Av. De Mayo 948, Buenos Aires","Venue: El Pantheon;Genre: Hard Trance;Genre: Rave","Nos levantamos a eso de las 15 hs, nos dedicamos a hacer todas esas tareas que no se pueden hacer en la semana y quedamos con Luis en ir al after hours del Pantheon. La familia salía de vacaciones y había que descontrolar. Puse la alarma a las 5:30 AM (domingo) y nos fuimos a dormir.\n\nDomingo a la mañana, bien temprano, ni panadería, ni carnicería y mucho menos misa. RAVE!!\n\nLlegamos y nos encontramos con Sebastián, Andrea, Javier y Lucas (muy ebrio!!). Decadencia en el Chill out zone. AWeX 'Back On Plastic', Con este nos empezamos a mover en serio. Había mucha gente (nunca vi tanta gente en el Pantheon), y unas rubias que me destrozaron.\n\nPasaron unos temas Monster House medio feos pero después se puso mejor. Las piernas me dolían pero había que seguir. \n\nDiego Roca estuvo muy bien con temas muy duros y nuevos, y después Diego Cid nos levantó con 'Chill Out' de Emmanuel Top, y nos dio leña con Hard Trance y Jungle. Buena música, 'lindo'.\n\nNos quedamos con Luis y Andrea hasta el final, y tuvimos nuestra recompensa. Algo que no escuchaba exactamente desde el 29/10/94 'Thousand', de Moby!!\n\nAceleración total y me sentí muy bien. Ya eran cerca o mas de las 11:00 am. Afuera estaba la loca delirante apurando a todo el mundo, Carlos, que había llegado tarde, los DJs con los discos al hombro, y dos mujeres que nos sacudieron.\n\nLlegamos a casa a eso de las 13 hs, comimos hamburguesas y a dormir.","/images/1996-AfterHours-Pantheon.png;/images/1996-AfterHours-Pantheonb.png;/images/1996-AfterHours-Pantheonc.png;/images/1996-AfterHours-Pantheond.jpg;/images/TheSecondReport_0154b.png;/images/TheSecondReport_0155.png;/images/TheSecondReport_0155b.png"
030,1996-08-30,"Frere","Olleros 1775, Buenos Aires","Venue: Frere;Genre: Pop;Genre: Funk;Genre: House","PUSSY CONTROL / everybody on line...\n\nEstaba medio destruído por el trabajo y la facultad pero decidí ir igual. Habíamos ido con Luis y Marcelo a la radio a presentar un par de temas y arreglaros para vernos con Sebastián y los chicos en Frere, una disco para chetos en Barracas de Belgrano.\n\nMucho no me convencía la idea, pero fuimos igual, parecía que había entradas gratis y bueno, si bien no fue tan así, tampoco fue tan distinto. Reconozco que yo sentía que tenía que estar en otro lugar.\n\nPero llegamos finalmente, el lugar era demasiado careta, hasta había gente de traje. En la puerta me encontré con Florencia, y más tarde llegaron Sebastián, Adrián y unos amigos/as.\n\nPasamos todos, los varones pagamos solo la consumición y apenas entramos vi a una chica apoyada en una columna que me destrozó. Era igual que Natasha Henstridge (Species), pero morocha. Cuerpo perfecto, cintura diminuta, ningún error. sensual, femenina, única, me mató.\n\nLa música era tipo Coolio, C&C Music Factory, George Michael, Prince 'Pussy Control', etc. Música que hace mover a las mujeres (en general, mal eh?)\n\nComo la música era mala había que hacer algo para divertirse, sino iba a ser terriblemente malo. El Cointreau, la cerveza y el Martini Rosso hicieron que el aburrimiento desaparezca. Como nos pegó ese trago, estábamos en la barra y estuve llorando de la risa en la barra sin poder parar delante de todos, y no aguantábamos más.\n\nBailamos cosas muy chocantes (pero todos temas extranjeros). Cada vez que pasaba La mujer nos queríamos matar. En general había muy buen material. Parecía que todos se conocían.\n\nDespués también fuimos arriba a tomar cerveza (más!) y vimos a un chabón destruído vomitar. No se como no nos echaron del lugar. Un mareo total, no sé que hubieran pensado ni hubiéramos tomado más, o si la música hubiera sido un poco mejor.\n\nYo no me quería ir del lugar ni decirle nada a La mujer. Espero a que pase sola y le pregunte si había nacido en este planeta...me miró, sonrió, dijo que si, y me mató. Fui corriendo y me tire por la escalera.\n\nDespués empezaron a pasar música dance mas actual y fue chocante cuando pasaron 'Who Is Elvis?', nos descontrolamos bastante.\n\nEstábamos muy destruídos y nos fuimos todos juntos. Con Luis y Marcelo tomamos mal el 55 y nos llevó a la terminal, en Barracas de  Belgrano.","/images/TheSecondReport_0157.png;/images/TheSecondReport_0157b.png;/images/TheSecondReport_0158.png;/images/TheSecondReport_0158b.png;/images/TheSecondReport_0159.png"
031,1996-08-31,"Venue TBC","TBC, Buenos Aires","Venue: TBC;Genre: Techno;Genre: House","Estuve toda la noche en la casa de Ariel conectado a la Red a búsqueda de información, gracias a la clave de Martín de Radiomensaje, el acceso era gratuito, solo había que saber cómo hacerlo, y lo descubrimos.\n\nLlegamos a casa a eso de las 6 AM pero Luis no podía venir así que nos fuimos solos. (Como quizás dentro de 6 meses cruzando el Atlántico). Llegamos pasadas las 7 AM y nos encontramos con Dyson (Fedor) y la novia, con Patricia, Sebastián, Javier, Marcelo, Carlos, la novia, Sabrina y Johanna, Daniel, Fernando, Maxi, la novia y muchas gárgolas.\n\nEl tema de Emmanuel Top que tiene la respiración en la INTRO me llevó a la pista. Me sorprendió la proyección de fractales en la pantalla.\n\nTerrible lo de Aldo Haydar y muy bueno lo de Miguel Silver, Luis Nieva y Gustavo López. Bailé bastante y tuve a una de los chicas de la velada perfecta cerca, ahí.\n\nVodka + Jugo de Limón + Amigos + Techno\nIan Pooley 'The Move' GAS! SOUNDTRACK","/images/TheSecondReport_0159b.png;/images/TheSecondReport_0160.png"
032,1996-09-07,"Pantheon (26 HORAS DESPIERTO)","Av. De Mayo 948, Buenos Aires","Venue: El Pantheon;Genre: Techno;Genre: House;Genre: Hard Trance","Ese sábado (domingo), llegué a casa con la F-100, destruído, a eso de las 6:45 AM. Dejé algunas cosas, me lave un poco y partí rumbo al Pantheon, sabiendo que poca gente hubiera hecho lo mismo. Casi me duermo en el nublado viaje pero llegué.\n\nEn la puerta me encontré con Hernán (el raver), y su amigo Pablo. Adentro estaba Luis, Marcelo, Sebastián, Claudio, Diego, Patricia. El lugar estaba lleno de gente y la música era violenta. En la pantalla se proyectaban imágenes de un video de una rave francesa con grupos en vivo tipo Westbam, Joey Beltram y Lunatic Asylum.\n\nEstaba pasando música Luis Nieva y escuchamos temas nuevos, o que quizás no habían pasado antes. Después tuve un DJ Español (Magoya Dj), que a pesar de un pseudónimo chocante nos sorprendió con House de vanguardia.\n\nSiguieron Gustavo López y Miguel Silver y no podíamos parar. Supuestamente yo tenía que estar cansado!\n\nLos chicos (Luis, Sebastián y Marcelo), se tenían que ir antes, y me quedé con los demás. Si no me hubiera quedado por me hubiera perdido 'Chill Out' de Emmanuel Top, y temazos Hard Trance (torturas a la 303), el hipnótico glorioso que tiene la parte Drum n' Bass, con un espejo adelante y una mujer al costado, algunos amigos y otros no tanto.\n\nWhere am I!? (the secret)\nI need a place to hide","/images/1996-Pantheonb.jpg;/images/TheSecondReport_0161.png;/images/TheSecondReport_0161b.png;/images/TheSecondReport_0162.png"
033,1996-09-14,"Pantheon","Av. De Mayo 948, Buenos Aires","Venue: El Pantheon;Genre: Techno;Genre: House","Había abierto un lugar nuevo dos días antes ('El Centro'), a metros de la 9 de Julio, nuestra idea era ir a conocer el lugar pero Lisa en la puerta nos pidió la accesible suma de $15. Intentamos entrar por otros medios, pero no se dio. Cruzamos la 9 de julio, ya estaba lloviendo, y nos metimos en el Pantheon.\n\nAdentro estaba Andrea y el chico del programa Segundo Sentido. Depeche Mode, New Order, The Cure, Information Society, Love & Rockets, Nitzer Ebb, Siouxsie & The Banshees, Lords Of The New Church. Estaba hablando con Mariano Reznik, un rato largo, y los gritos de 'Monkey Say, Monkey Do' me llevaron a la pista (una vez mas!). \n\nDespués, nos sorprendió el video de 'Everybody In The Place' y saltamos. Después, 'Los Niños Del Parque', 'Closer' y no sé qué más. \n\nObviamente nos quedamos al after hour. Llegaron Sebastián, Marcelo, Carlos y la novia, Sabrina, Johanna y Javier. Entraron unos gárgolas (entre ellos la gárgola de Caix), y algo increíble, Dj Deró en Pantheon!\n\nHabía muy buen material femenino y las dos de la velada nos mataron (y se fumaron un porro). \n\nEn general la música fue buena pero no alcanzaba a tocarme, salvo lo que pasó Miguel Silver 303, yo estaba muy cansado, medio anulado pero saque energía, vaya a saber de dónde, cuando Diego Cid puso 'This Is Not a Mind Trip' de Air Liquide, Emmanuel Top y 'G-Force' y 'Rip Up The Sound System' de The Prodigy. \n\nTotal / Mental / Brutal / Mortal (afuera llovía, adentro ardía)","/images/1996-Pantheonb.jpg;/images/TheSecondReport_0164b.png;/images/TheSecondReport_0165.png;/images/TheSecondReport_0165b.png"
034,1996-10-05,"Back to Caix","Av. Costanera Rafael Obligado 1221, Buenos Aires","Venue: Caix;Genre: Techno Pop;Genre: House;Genre: Trance","Fernando me dijo que vaya a la casa a la medianoche y caí cerca de la 1 am. Nos pasó a buscar Facundo en un VW Gol y dos chicos más, y paramos en una estación de servicio donde compramos una botella de champagne y un licor de naranja.\n\nDirecto a la autopista a mas de 110 km/hora escuchando música chocante Billy Idol. El champagne casi natural era feo, pero el licor era venenoso. Cuando lo tragaba me quemaba la garganta.\n\nLevantamos a Rodolfo en el Paseo Alcorta y fuimos a Caix otra vez. Pasé con la botella de licor abajo del brazo (dentro de la campera) y brindamos adentro.\n\nLa música era basura y estábamos alegres (no por lo que escuchábamos). Bailamos boludeces de afuera, tomamos gin con limón y Gancia batido. A Fernando le habían cambiado la cara. \nYo no sé. Me acuerdo de haber escuchado 'Bizarre Love Triangle' (twice), y arriba en el VIP, 'Jump Around' de House of Pain.\n\nÍbamos y veníamos cada vez que se escuchaban letras en castellano. Nada más nos reíamos y decíamos la palabra 'gárgola', tooodo el tiempo.\n\nAl final pasaban House y Trance más fino (Higher State '96), y otros cosas interesantes.\n\nAfuera ya de día, terminó con Ambient Trance y BBE 'Seven Days and One Week'. La vuelta fue salvaje.","/images/TheSecondReport_0166b.png;/images/TheSecondReport_0167.png;/images/TheSecondReport_0167b.png"